{
  "schemaVersion": 1,
  "kind": "SourceArtifactManifest",
  "requiredPaths": [
    "AGENTS.md",
    "CLAUDE.md",
    "LOCAL_BUILD_SOP.md",
    "SECURITY.md",
    "LICENSE",
    "README.md",
    "CHANGELOG.md",
    "package.json",
    "package-lock.json",
    "release.config.json",
    ".gitattributes",
    "rust-toolchain.toml",
    "requirements-audit.in",
    "requirements-audit.txt",
    "requirements-ci.in",
    "requirements-ci.txt",
    "tools/ci_action_pins.json",
    "tools/verify_ci_action_pins.js",
    "tools/verify_ci_action_pins.test.js",
    "tools/verify_release_acceptance_evidence.js",
    "tools/create_release_acceptance_evidence.js",
    "tools/create_release_acceptance_attestation.js",
    "tools/verify_release_acceptance_attestation.js",
    "tools/verify_release_trust_anchors.js",
    "tools/release_seal_signature.js",
    "tools/release_acceptance_contract.js",
    "tools/release_acceptance_contract.test.js",
    "tools/release_acceptance_attestation.test.js",
    "tools/schemas/release_acceptance_evidence.schema.json",
    "renderer/index.html",
    "renderer/app.js",
    "renderer/styles.css",
    "renderer/tauri-bridge.js",
    "src-tauri/Cargo.toml",
    "src-tauri/Cargo.lock",
    "src-tauri/tauri.conf.json",
    "src-tauri/tauri.macos.conf.json",
    "src-tauri/tauri.windows.conf.json",
    "src-tauri/build.rs",
    "src-tauri/nsis-hooks.nsh",
    "injector/CavalryTranslatorInjector.mm",
    "injector/generated_translations.inc",
    "injector/cavalry_i18n_translation_policy.h",
    "languages/en/appStrings.json",
    "languages/zh-Hans/appStrings.json",
    "languages/zh-Hant/appStrings.json",
    "languages/ja_JP/appStrings.json",
    "tools/release_metadata.js",
    "tools/check_tauri_build_sop.js",
    "tools/build_translator_injector.sh",
    "tools/cavalry_qt_target.json",
    "tools/generate_embedded_translations.js",
    "tools/source_artifact_manifest.json",
    "tools/create_source_artifact.js",
    "tools/verify_source_artifact.js",
    "tools/verify_source_artifact.test.js",
    "tools/verify_release_acceptance_seal.js",
    "tools/release_publish.js",
    "tools/create_sbom.js",
    "tools/verify_release_provenance.js",
    "tools/record_toolchain_evidence.js",
    "tools/npm_command.js",
    "tools/create_toolchain_evidence_bundle.js",
    "tools/schemas/release_acceptance_seal.schema.json",
    "tools/schemas/release_toolchain_evidence.schema.json",
    "tools/schemas/source_artifact_manifest.schema.json",
    "tools/macos-acceptance/acceptance_harness.js",
    "tools/macos-acceptance/source_contract.js",
    "tools/macos-acceptance/build_acceptance_v2.sh",
    "tools/windows-acceptance/acceptance_contract.js",
    "tools/windows-acceptance/record_windows_acceptance.js",
    "tools/windows-acceptance/review_windows_acceptance.js",
    "tools/windows-acceptance/check_contract.test.js",
    "tools/windows-acceptance/CLAUDE.md",
    "tools/schemas/windows_release_acceptance.schema.json",
    "tools/dependency_vulnerability_gate.json",
    "tools/dependency_vulnerability_gate.js",
    "tools/dependency_vulnerability_gate.test.js",
    "tools/verify_runner_image.js",
    "tools/resolve_cavalry_qt_sdk.js"
  ],
  "sourceArchivePaths": [
    ".gitattributes",
    ".github",
    ".gitignore",
    "AGENTS.md",
    "CHANGELOG.md",
    "CLAUDE.md",
    "LICENSE",
    "LOCAL_BUILD_SOP.md",
    "README.ja_JP.md",
    "README.md",
    "README.zh-Hans.md",
    "README.zh-Hant.md",
    "SECURITY.md",
    "docs",
    "injector",
    "languages",
    "package-lock.json",
    "package.json",
    "release-seals",
    "release.config.json",
    "renderer",
    "requirements-audit.in",
    "requirements-audit.txt",
    "requirements-ci.in",
    "requirements-ci.txt",
    "rust-toolchain.toml",
    "src-tauri",
    "tools"
  ],
  "artifactIdentity": {
    "schemaVersion": 1,
    "kind": "CavalryI18nSourceArtifact",
    "markerPath": ".cavalry-i18n-source-artifact.json"
  },
  "forbiddenPathPrefixes": [
    ".git",
    "node_modules",
    "qt_sdk",
    "src-tauri/target",
    "dist",
    "output"
  ],
  "forbiddenFileExtensions": [
    ".dll",
    ".dylib",
    ".so",
    ".a",
    ".lib",
    ".node",
    ".exe",
    ".pdb",
    ".dmg",
    ".msi",
    ".pkg",
    ".p12",
    ".pfx",
    ".pem",
    ".key",
    ".mobileprovision"
  ],
  "forbiddenFileNames": [
    ".netrc",
    ".npmrc",
    ".pypirc",
    "credentials.json",
    "secrets.json",
    "id_rsa",
    "id_ed25519"
  ]
}
